{
  "core_count": 173,
  "core_rule": "diversity_not_NA_and_pred_log10_N_not_NA",
  "source": {
    "commit": "b8f91d5c34675733db8cae8dcab625dcbb55c30a",
    "path": "data/combined_data.tsv",
    "repository": "https://github.com/vsbuffalo/paradox_variation.git",
    "sha256": "df559451dad94b53ba8675e09811708107a57eeb6ffe8f72b944bcbbf3a1f2eb",
    "size_bytes": 171863,
    "url": "https://raw.githubusercontent.com/vsbuffalo/paradox_variation/b8f91d5c34675733db8cae8dcab625dcbb55c30a/data/combined_data.tsv"
  },
  "species": [
    {
      "buffalo_diversity": "0.00727197",
      "buffalo_pred_log10_N": "11.066602451255369",
      "scientific_name": "Abatus agassizi"
    },
    {
      "buffalo_diversity": "0.0088125",
      "buffalo_pred_log10_N": "13.41890759893784",
      "scientific_name": "Acyrthosiphon pisum"
    },
    {
      "buffalo_diversity": "0.01421",
      "buffalo_pred_log10_N": "14.360999627393882",
      "scientific_name": "Aedes aegypti"
    },
    {
      "buffalo_diversity": "0.0059",
      "buffalo_pred_log10_N": "9.245133568016353",
      "scientific_name": "Agelaius phoeniceus"
    },
    {
      "buffalo_diversity": "0.00135",
      "buffalo_pred_log10_N": "6.2308759148410235",
      "scientific_name": "Ailuropoda melanoleuca"
    },
    {
      "buffalo_diversity": "0.0449719",
      "buffalo_pred_log10_N": "10.163409272461077",
      "scientific_name": "Allolobophora chlorotica"
    },
    {
      "buffalo_diversity": "0.023700000000000002",
      "buffalo_pred_log10_N": "6.007279159000476",
      "scientific_name": "Amphimedon queenslandica"
    },
    {
      "buffalo_diversity": "0.022000000000000002",
      "buffalo_pred_log10_N": "13.665252519460575",
      "scientific_name": "Anopheles arabiensis"
    },
    {
      "buffalo_diversity": "0.02947415109212225",
      "buffalo_pred_log10_N": "13.774331255103972",
      "scientific_name": "Anopheles gambiae"
    },
    {
      "buffalo_diversity": "0.0124",
      "buffalo_pred_log10_N": "12.584868176648294",
      "scientific_name": "Anopheles merus"
    },
    {
      "buffalo_diversity": "0.022799999999999997",
      "buffalo_pred_log10_N": "11.970805098310707",
      "scientific_name": "Anopheles quadriannulatus"
    },
    {
      "buffalo_diversity": "0.00848",
      "buffalo_pred_log10_N": "12.326106734387935",
      "scientific_name": "Apis cerana"
    },
    {
      "buffalo_diversity": "0.007352465743638745",
      "buffalo_pred_log10_N": "12.420231037532867",
      "scientific_name": "Apis mellifera"
    },
    {
      "buffalo_diversity": "0.0265455",
      "buffalo_pred_log10_N": "8.825971470744676",
      "scientific_name": "Aporrectodea icterica"
    },
    {
      "buffalo_diversity": "0.00263499",
      "buffalo_pred_log10_N": "6.478053207702797",
      "scientific_name": "Aptenodytes patagonicus"
    },
    {
      "buffalo_diversity": "0.001143",
      "buffalo_pred_log10_N": "8.055638437463793",
      "scientific_name": "Aquila clanga/pomarina"
    },
    {
      "buffalo_diversity": "0.0185015",
      "buffalo_pred_log10_N": "11.416248267499743",
      "scientific_name": "Armadillidium nasatum"
    },
    {
      "buffalo_diversity": "0.0187064",
      "buffalo_pred_log10_N": "12.095904456351107",
      "scientific_name": "Armadillidium vulgare"
    },
    {
      "buffalo_diversity": "0.01072",
      "buffalo_pred_log10_N": "11.34706828578026",
      "scientific_name": "Artemia franciscana"
    },
    {
      "buffalo_diversity": "0.0059074",
      "buffalo_pred_log10_N": "11.838679124812531",
      "scientific_name": "Artemia salina"
    },
    {
      "buffalo_diversity": "0.0023",
      "buffalo_pred_log10_N": "11.028856010057499",
      "scientific_name": "Bactrocera depressa"
    },
    {
      "buffalo_diversity": "0.00387",
      "buffalo_pred_log10_N": "7.0072163248195345",
      "scientific_name": "Balaenoptera bonaerensis"
    },
    {
      "buffalo_diversity": "0.0276330106765374",
      "buffalo_pred_log10_N": "10.097899045142208",
      "scientific_name": "Bombyx mandarina"
    },
    {
      "buffalo_diversity": "0.0012129503490739102",
      "buffalo_pred_log10_N": "6.850150367336139",
      "scientific_name": "Bos taurus"
    },
    {
      "buffalo_diversity": "0.0834581",
      "buffalo_pred_log10_N": "12.595731913117552",
      "scientific_name": "Bostrycapulus aculeatus"
    },
    {
      "buffalo_diversity": "0.002907267566300975",
      "buffalo_pred_log10_N": "15.183158639952977",
      "scientific_name": "Caenorhabditis elegans"
    },
    {
      "buffalo_diversity": "0.00123",
      "buffalo_pred_log10_N": "8.439980516295373",
      "scientific_name": "Callithrix jacchus"
    },
    {
      "buffalo_diversity": "0.00332756",
      "buffalo_pred_log10_N": "11.43856230471875",
      "scientific_name": "Camponotus aethiops"
    },
    {
      "buffalo_diversity": "0.00164517",
      "buffalo_pred_log10_N": "11.30793970675221",
      "scientific_name": "Camponotus ligniperdus"
    },
    {
      "buffalo_diversity": "0.001712",
      "buffalo_pred_log10_N": "8.666961590513239",
      "scientific_name": "Canis latrans/lupus"
    },
    {
      "buffalo_diversity": "0.0014913104212410302",
      "buffalo_pred_log10_N": "7.9126426087215895",
      "scientific_name": "Canis lupus"
    },
    {
      "buffalo_diversity": "0.00871331",
      "buffalo_pred_log10_N": "10.448615185187572",
      "scientific_name": "Carcinus aestuarii"
    },
    {
      "buffalo_diversity": "0.011265",
      "buffalo_pred_log10_N": "12.038541828466615",
      "scientific_name": "Cecidostiba fungosa"
    },
    {
      "buffalo_diversity": "0.02951",
      "buffalo_pred_log10_N": "13.864781308675477",
      "scientific_name": "Ceratitis capitata"
    },
    {
      "buffalo_diversity": "0.00163381",
      "buffalo_pred_log10_N": "4.520317603709664",
      "scientific_name": "Chelonoidis nigra"
    },
    {
      "buffalo_diversity": "0.00233",
      "buffalo_pred_log10_N": "7.355842594130447",
      "scientific_name": "Chlorocebus aethiops"
    },
    {
      "buffalo_diversity": "0.010333333333333333",
      "buffalo_pred_log10_N": "6.991932834591689",
      "scientific_name": "Cichla pleiozona"
    },
    {
      "buffalo_diversity": "0.029688075",
      "buffalo_pred_log10_N": "9.010834562381046",
      "scientific_name": "Ciona intestinalis"
    },
    {
      "buffalo_diversity": "0.0801",
      "buffalo_pred_log10_N": "8.141271135526765",
      "scientific_name": "Ciona savignyi"
    },
    {
      "buffalo_diversity": "0.03318",
      "buffalo_pred_log10_N": "9.578145148069686",
      "scientific_name": "Crassostrea gigas"
    },
    {
      "buffalo_diversity": "0.0225892",
      "buffalo_pred_log10_N": "10.818384769184131",
      "scientific_name": "Crepidula fornicata"
    },
    {
      "buffalo_diversity": "0.0250816",
      "buffalo_pred_log10_N": "13.085881484296722",
      "scientific_name": "Crepidula plana"
    },
    {
      "buffalo_diversity": "0.0327737",
      "buffalo_pred_log10_N": "12.299442963090575",
      "scientific_name": "Culex hortensis"
    },
    {
      "buffalo_diversity": "0.0412972",
      "buffalo_pred_log10_N": "13.010138132322588",
      "scientific_name": "Culex pipiens"
    },
    {
      "buffalo_diversity": "0.0163186",
      "buffalo_pred_log10_N": "11.437907364975",
      "scientific_name": "Culex torrentium"
    },
    {
      "buffalo_diversity": "0.00640178383438718",
      "buffalo_pred_log10_N": "7.247628816865876",
      "scientific_name": "Cynoglossus semilaevis"
    },
    {
      "buffalo_diversity": "0.038988400000000006",
      "buffalo_pred_log10_N": "13.359633308281735",
      "scientific_name": "Cystodytes dellechiajei"
    },
    {
      "buffalo_diversity": "0.009173960860790491",
      "buffalo_pred_log10_N": "10.599487030636016",
      "scientific_name": "Danio rerio"
    },
    {
      "buffalo_diversity": "0.013179999999999999",
      "buffalo_pred_log10_N": "12.333797109647673",
      "scientific_name": "Daphnia magna"
    },
    {
      "buffalo_diversity": "0.011765000000000001",
      "buffalo_pred_log10_N": "11.898556543440653",
      "scientific_name": "Daphnia obtusa"
    },
    {
      "buffalo_diversity": "0.022029999999999998",
      "buffalo_pred_log10_N": "12.400372406466426",
      "scientific_name": "Daphnia pulex"
    },
    {
      "buffalo_diversity": "0.020225",
      "buffalo_pred_log10_N": "11.941036332778046",
      "scientific_name": "Daphnia pulicaria"
    },
    {
      "buffalo_diversity": "0.00153",
      "buffalo_pred_log10_N": "8.184694656814962",
      "scientific_name": "Dasypus novemcinctus"
    },
    {
      "buffalo_diversity": "7.3e-4",
      "buffalo_pred_log10_N": "6.339011297902625",
      "scientific_name": "Daubentonia madagascariensis"
    },
    {
      "buffalo_diversity": "0.02153",
      "buffalo_pred_log10_N": "13.142955571520782",
      "scientific_name": "Drosophila americana"
    },
    {
      "buffalo_diversity": "0.0236",
      "buffalo_pred_log10_N": "14.233605985378473",
      "scientific_name": "Drosophila ananassae"
    },
    {
      "buffalo_diversity": "0.008285",
      "buffalo_pred_log10_N": "12.959062908693625",
      "scientific_name": "Drosophila arizonae"
    },
    {
      "buffalo_diversity": "0.020099999999999996",
      "buffalo_pred_log10_N": "13.70693403448566",
      "scientific_name": "Drosophila bipectinata"
    },
    {
      "buffalo_diversity": "0.01936",
      "buffalo_pred_log10_N": "13.288993006409903",
      "scientific_name": "Drosophila buzzatii"
    },
    {
      "buffalo_diversity": "0.0323",
      "buffalo_pred_log10_N": "14.09703082347629",
      "scientific_name": "Drosophila kikkawai"
    },
    {
      "buffalo_diversity": "0.0168",
      "buffalo_pred_log10_N": "13.792108411307558",
      "scientific_name": "Drosophila malerkotliana"
    },
    {
      "buffalo_diversity": "0.014459007734934385",
      "buffalo_pred_log10_N": "14.5564099961026",